<?xml version="1.0" encoding="UTF-8"?>
<variability-exchange-models id="root" xmlns:xsi="http://www.w3.org/2001/XMLSchema-instance" xsi:noNamespaceSchemaLocation="../VEL.xsd">
	<version>1</version>
	<variability-exchange-model type="variationpoint-description" id="model">
		<structural-variationpoint id="vp1" type="xor">
			<variation id="vp1v1" name="Alternative 1">
				<condition type="single-feature-condition">Feature1</condition>
			</variation>
			<variation id="vp1v2" name="Alternative 2">
				<condition type="single-feature-condition">Feature2</condition>
			</variation>
			<variation id="vp1v3" name="Alternative 3">
				<condition type="single-feature-condition">Feature3</condition>
			</variation>
		</structural-variationpoint>
	</variability-exchange-model>
</variability-exchange-models>
