<?xml version="1.0" encoding="UTF-8"?>
<variability-exchange-models id="root" xmlns:xsi="http://www.w3.org/2001/XMLSchema-instance" xsi:noNamespaceSchemaLocation="../VEL.xsd">
	<version>1</version>
	<variability-exchange-model type="variationpoint-description" id="m1">
		<!-- A variationpoint with multiple binding times. This means that the bindingtime for this variationpoint has not yet been decided.-->
		<structural-variationpoint id="vp1" type="optional">
			<bindingtime>
				<name>code-generation-time</name>
			</bindingtime>
			<bindingtime>
				<name>preprocessor-time</name>
			</bindingtime>
			<bindingtime>
				<name>compile-time</name>
			</bindingtime>
			<variation id="vp1v1">
				<condition type="single-feature-condition">Feature1</condition>
			</variation>
		</structural-variationpoint>
		<structural-variationpoint id="vp2" type="optional">
			<!-- A variationpoint with multiple binding times. One binding time is selected (that is, a binding time has been decided for the variationpoint); the other(s) can be ignored. -->
			<bindingtime selected="true">
				<name>code-generation-time</name>
			</bindingtime>
			<bindingtime>
				<name>post-build</name>
			</bindingtime>
			<variation id="vp2v1">
				<condition type="single-feature-condition">Feature1</condition>
			</variation>
		</structural-variationpoint>
		<structural-variationpoint id="vp3"  type="optional">
			<!-- Same as above, but the attribute selected is present on all binding times. -->
			<bindingtime selected="true">
				<name>code-generation-time</name>
			</bindingtime>
			<bindingtime selected="false">
				<name>post-build</name>
			</bindingtime>
			<variation id="vp3v1">
				<condition type="single-feature-condition">Feature1</condition>
			</variation>
		</structural-variationpoint>
	</variability-exchange-model>
</variability-exchange-models>
